[
  {
    "project_id": "account-scope-hotfix",
    "agent_id": "reviewer_agent",
    "role": "reviewer_agent",
    "status": "done",
    "approach_summary": "verdict: changes_requested. [task-fix-001] Invoice update is fixed, but customers/update.js has the same body spread.",
    "reads": [
      "orchestrator/memory/core.md",
      "orchestrator/memory/lessons.json"
    ],
    "writes": [],
    "files_touched": [],
    "surprises": [],
    "assumptions": [],
    "findings": [
      "verdict: changes_requested",
      "server/src/customers/update.js:14 spreads req.body into the update; the same accountId hole as bug-001. Allowlist the fields."
    ],
    "blockers": [],
    "handoff_to": [
      "lead_agent"
    ],
    "user_feedback": [],
    "updated_at": "2026-10-06T17:00:00Z"
  },
  {
    "project_id": "account-scope-hotfix",
    "agent_id": "reviewer_agent",
    "role": "reviewer_agent",
    "status": "done",
    "approach_summary": "verdict: approved. [task-fix-001] Both controllers allowlist fields; the cross-account test passes.",
    "reads": [
      "orchestrator/memory/core.md",
      "orchestrator/memory/lessons.json"
    ],
    "writes": [],
    "files_touched": [],
    "surprises": [],
    "assumptions": [],
    "findings": [],
    "blockers": [],
    "handoff_to": [
      "lead_agent"
    ],
    "user_feedback": [],
    "updated_at": "2026-10-07T13:00:00Z"
  }
]
